title,url,thumbnail_url,channel,description
OFFLINETV SURVIVES CAMPING CHALLENGE,https://www.youtube.com/watch?v=jXtu2Lk4Olk,https://i.ytimg.com/vi/jXtu2Lk4Olk/hqdefault.jpg?sqp=-oaymwEcCPYBEIoBSFXyq4qpAw4IARUAAIhCGAFwAcABBg==&rs=AOn4CLDED3fuPoa6ZzbehQ1xySj0_ZFlxg,OfflineTV,Where should we go camping next? Go to https://buyraycon.com/offlinetv to get 15% off your Raycon purchase! ---------------------------------------------- 👕 Merch & Apparel: • OfflineTV...
BTS (방탄소년단) 'Yet To Come (The Most Beautiful Moment)' Official MV,https://www.youtube.com/watch?v=kXpOEzNZ8hQ,https://i.ytimg.com/vi/kXpOEzNZ8hQ/hqdefault.jpg?sqp=-oaymwEcCPYBEIoBSFXyq4qpAw4IARUAAIhCGAFwAcABBg==&rs=AOn4CLAmzG761Gvzy3EvHfqSlOJV_jSThg,HYBE LABELS,BTS (방탄소년단) 'Yet To Come (The Most Beautiful Moment)' Official MV Share your favorite #MyBTStory 💜 0:00 #MyBTStory 1:44 share your fav BTS story 2:00 Only on YouTube Shorts ...
I Got Tinder as Minecraft Man...,https://www.youtube.com/watch?v=Xr_vYZFRMzU,https://i.ytimg.com/vi/Xr_vYZFRMzU/hqdefault.jpg?sqp=-oaymwEcCPYBEIoBSFXyq4qpAw4IARUAAIhCGAFwAcABBg==&rs=AOn4CLCOIvF02mbmwDOfUSWXrN6P8T8HFA,TommyInnit,"I downloaded Tinder for the first time. This did not go well. Well, I guess it did. Thanks to the following: Logan Paul, Tubbo, Ranboo, & Charlie D'Melio. Socials: Follow my Twitter - @tommyinnit..."
Extreme Construction Truck Battle,https://www.youtube.com/watch?v=Qphzma9v7hk,,videogamedunkey,select your hat https://dunkeyscastle.com/
I Survived 100 DAYS as a HYDRA in HARDCORE Minecraft!,https://www.youtube.com/watch?v=N54CB1Rdkeo,,Bronzo,"💥 Hey Bronzo Army, looking for a new PC? Well I’ve partnered with Apex Gaming with my own line of PCs! Click the link and use the discount code 'Bronzo' for up to $250 off your next purchase!..."
Dudes always gotta lie in basketball everytime something don't go their way,https://www.youtube.com/watch?v=N4F_VfGv2nY,,RDCworld1,Yall gotta stop doing this on the court LOL! it really takes the fun out of basketball man
Luke TheNotable vs The Warden,https://www.youtube.com/watch?v=Hbg-_olkBfk,,Luke TheNotable,"In this video, Luke TheNotable will be fighting THE WARDEN. The new boss monster in Minecraft. Will he survive? Watch to find out! Follow me on Twitter!! - https://twitter.com/LukeTheNotable..."
"WARRIORS at CELTICS | FULL GAME 4 NBA FINALS HIGHLIGHTS | June 10, 2022",https://www.youtube.com/watch?v=B-5StlRZInc,,NBA,"Stay up-to-date on news, live scores and stats with the NBA App:https://app.link.nba.com/app22 Led by Stephen Curry’s 43 PTS (7-14 3pt FG), 10 REB and 4 AST, the Golden State Warriors defeated..."
I'M CAMP ROCK,https://www.youtube.com/watch?v=ypoP8LE-oMQ,,Danny Gonzalez,"Thanks to Current for sponsoring this video! Get Current, use my code GREG for a chance to win and learn more: https://current.com/greg stream the song https://songwhip.com/dannygonzalez/kevin-jon..."
"Pharrell Williams - Cash In Cash Out (Official Video) ft. 21 Savage, Tyler, The Creator",https://www.youtube.com/watch?v=cKEwnhc8ItY,,Pharrell Williams,"Official video for “Cash In Cash Out” by Pharrell Williams, 21 Savage & Tyler, the Creator Listen & Download “Cash In Cash Out” out now: https://pharrellwilliams.lnk.to/CICO Preorder..."
